informasjonstype,navn,ingress,beskrivelse,kontekstavhengig_beskrivelse,normeringsniva,eif_niva,status,samhandlingstjenester,ansvarlig,referanse_lenketekst,referanse_url
Krav og prinsipper ,Referansearkitektur for datadeling,,Referansearkitektur for datadeling er en av flere referansearkitekturer innen elektronisk samhandling i helse- og omsorgssektoren,,Nasjonale faglige råd,"Organisatorisk, Semantisk, Teknisk",Eksisterer,Pasientens kritiske informasjon,Helsedirektoratet,Referansearkitektur for datadeling,https://www.helsedirektoratet.no/faglige-rad/referansearkitektur-for-datadeling/referansearkitektur-for-datadeling.pdf/_/attachment/inline/83b90a46-dd31-46ec-80fc-bbf886c4cfa4:c6974e511e5ef3093716e9f0d93287d4fead977f/Referansearkitektur%20for%20datadeling.pdf
Krav og prinsipper ,Forretningsmessige arkitekturprinsipper for dokumentdeling,,"Prinsippene gir føringer for det organisatoriske nivået av dokumentdeling og handler om ansvar for bruk og publisering av dokumenter.
Prinsippene er beskrevet i kapittel 6 i målarkitekturen.",,Nasjonale faglige råd,Organisatorisk,Eksisterer,Pasientens journaldokumenter,Helsedirektoratet,"Målarkitektur for dokumentdeling, se kap. 6.1",https://www.helsedirektoratet.no/faglige-rad/malarkitektur-for-dokumentdeling/malarkitektur-for-dokumentdeling.pdf/_/attachment/inline/189c3c04-6baa-4007-90a5-fb49312d9e1e:e327395240bcaadedde5a2daff935836ccb888b8/Målarkitektur%20for%20dokumentdeling.pdf
Samhandlingskomponent ,Dokumentregister (Document Registry),,"En fellestjeneste i en dokumentdelingsløsning som inneholder alle søkbare metadata om dokumentene inkludert, en peker til det dokumentlageret hvor dokumentet er lagret. Registeret tilbyr søk til alle konsumerende virksomheter. I tillegg tilbyr det et grensesnitt for registering av metadata om et dokument.",,,Teknisk,Eksisterer,Pasientens journaldokumenter,Det enkelte samarbeidsområdet,Målarkitektur for dokumentdeling,https://www.helsedirektoratet.no/faglige-rad/malarkitektur-for-dokumentdeling/malarkitektur-for-dokumentdeling.pdf/_/attachment/inline/189c3c04-6baa-4007-90a5-fb49312d9e1e:e327395240bcaadedde5a2daff935836ccb888b8/Målarkitektur%20for%20dokumentdeling.pdf
Samhandlingskomponent ,Koblingspunkt for lokalt/regionalt samarbeidsområde (Clinical Affinity Domain / XCA Gateway),,Koblingspunkt som gjør det mulig for andre samarbeidsområder å spørre om og hente dokumenter.,,,Teknisk,Eksisterer,Pasientens journaldokumenter,Det enkelte samarbeidsområdet,Målarkitektur for dokumentdeling,https://www.helsedirektoratet.no/faglige-rad/malarkitektur-for-dokumentdeling/malarkitektur-for-dokumentdeling.pdf/_/attachment/inline/189c3c04-6baa-4007-90a5-fb49312d9e1e:e327395240bcaadedde5a2daff935836ccb888b8/Målarkitektur%20for%20dokumentdeling.pdf
Informasjonsmodell ,Rekvirering av medisinske tjenester v1.6,,Melding for rekvirering av tjenester innen radiologi og laboratoriemedisin,,Obligatorisk standard,Semantisk,Eksisterer,Pasientens prøvesvar,Helsedirektoratet,Rekvirering av medisinske tjenester v1.6,https://www.helsedirektoratet.no/standarder/rekvirering-av-medisinske-tjenester-v1.6
Informasjonsmodell ,Nasjonal informasjonsmodell for oppsummerende pasientopplysninger,,"Helsedirektoratet arbeider med å beskrive overordnet struktur og innhold for ulike typer helseinformasjon, uavhengig av formål og teknisk løsning.",,,Semantisk,Under utvikling,Pasientens kritiske informasjon,Helsedirektoratet,Nasjonal informasjonsmodell for oppsummerende pasientopplysninger,https://www.helsedirektoratet.no/horinger/nasjonal-informasjonsmodell-helse-nim-for-oppsummerende-helseopplysninger
Informasjonsmodell ,M25.1 Legemidler i bruk (Pasientens legemiddelliste),,Meldingsstandard for legemidler i bruk (pasientens legemiddelliste). Dette er beskrevet i M25-meldingsstandardene. Dokumentasjonen inneholder informasjonsmodellen for legemidler i bruk. ,,,Semantisk,,Pasientens legemiddelliste,Helsedirektoratet,Legemidler i bruk (Pasientens legemiddelliste),https://www.helsedirektoratet.no/standarder/m25.1-legemidler-i-bruk
Informasjonsmodell ,Informasjonsmodell for FEST-katalogen,,"Beskrivelse av informasjonsinnholdet i forskrivnings- og ekspedisjonsstøtte (FEST). Se også ""FEST Implementeringsveiledning"" Fra Direktoratet for medisinske produkter. ",,,Semantisk,Eksisterer,Pasientens legemiddelliste,Helsedirektoratet,Informasjonsmodell for FEST-katalogen,https://www.helsedirektoratet.no/standarder/m30-fest-meldingen
Informasjonsmodell ,Svarrapportering av medisinske tjenester v1.4,,"Standard som beskriver den overordnede informasjonsmodellen for elektronisk svarrapportering av medisinske tjenester, og dekker laboratoriesvar og radiologisvar. Standarden brukes ikke selvstendig, kun gjennom profiler, som angitt i lenken.",,Obligatorisk standard,Semantisk,Eksisterer,Pasientens prøvesvar,Helsedirektoratet,Svarrapportering av medisinske tjenester v.1.4,https://www.helsedirektoratet.no/standarder/svarrapportering-av-medisinske-tjenester-v1.4
Informasjonsmodell ,Nasjonal informasjonsmodell for overfølsomhetsreaksjoner,,Informasjonsmodellen beskriver informasjon som er viktig å dele for å ivareta pasientsikkerhet ved overfølsomhetsreaksjoner. Informasjonsmodellen er en del av Nasjonal informasjonsmodell for oppsummerende pasientopplysninger. ,,,Semantisk,Under utvikling,"Pasientens kritiske informasjon, Pasientens legemiddelliste",Helsedirektoratet,Høringsutkast nasjonal informasjonsmodell for oppsummerende pasientopplysninger,https://www.helsedirektoratet.no/horinger/nasjonal-informasjonsmodell-helse-nim-for-oppsummerende-helseopplysninger
Krav og prinsipper ,Informasjons- og sikkerhetsprinsipper for dokumentdeling,,"Prinsippene gir føringer for informasjonssikkerhet og det semantiske nivået av dokumentdeling og handler om ivaretakelse av informasjonssikkerhet, bruk av metadata og versjonshåndtering. Prinsippene er beskrevet i kapittel 6 i målarkitekturen.",,Nasjonale faglige råd,Semantisk,Eksisterer,Pasientens journaldokumenter,Helsedirektoratet,"Målarkitektur for dokumentdeling, se kap 6.1",https://www.helsedirektoratet.no/faglige-rad/malarkitektur-for-dokumentdeling/malarkitektur-for-dokumentdeling.pdf/_/attachment/inline/189c3c04-6baa-4007-90a5-fb49312d9e1e:e327395240bcaadedde5a2daff935836ccb888b8/Målarkitektur%20for%20dokumentdeling.pdf
Krav og prinsipper ,Tekniske arkitekturprinsipper for dokumentdeling,,Prinsippene gir føringer for det tekniske nivået av dokumentdeling og handler om tilgjengelighet og bruk av tekniske standarder og infrastruktur. Prinsippene er beskrevet i kapittel 6 i målarkitekturen.,,Nasjonale faglige råd,Teknisk,Eksisterer,Pasientens journaldokumenter,Helsedirektoratet,"Målarkitektur for dokumentdeling, se kap. 6.1",https://www.helsedirektoratet.no/faglige-rad/malarkitektur-for-dokumentdeling/malarkitektur-for-dokumentdeling.pdf/_/attachment/inline/189c3c04-6baa-4007-90a5-fb49312d9e1e:e327395240bcaadedde5a2daff935836ccb888b8/Målarkitektur%20for%20dokumentdeling.pdf
Krav og prinsipper ,Referansearkitektur for dokumentdeling,,Dette dokumentet beskriver nasjonal referansearkitektur for dokumentdeling innen helse- og omsorgstjenesten.,,Nasjonale faglige råd,"Organisatorisk, Teknisk",Eksisterer,Pasientens journaldokumenter,Helsedirektoratet,Referansearkitektur for dokumentdeling,https://www.helsedirektoratet.no/faglige-rad/referansearkitektur-for-dokumentdeling/referansearkitektur-for-dokumentdeling.pdf/_/attachment/inline/d369a467-bf63-418e-8edc-38bf248d9759:a34bebf1afe17bbf5b70dc44edc82510d2c14ec3/Referansearkitektur%20for%20dokumentdeling.pdf
Krav og prinsipper ,Målarkitektur for nasjonal dokumentdeling,,"Målarkitekturen har som målsetning å sikre nasjonal dokumentoversikt for alle pasienter, hvor pasienten selv eller personer med fullmakt, samt personell med tjenstlig behov, kan få innsyn i dokumentene.",,Nasjonale faglige råd,"Organisatorisk, Semantisk, Teknisk",Eksisterer,Pasientens journaldokumenter,Helsedirektoratet,Målarkitektur for dokumentdeling,https://www.helsedirektoratet.no/faglige-rad/malarkitektur-for-dokumentdeling/malarkitektur-for-dokumentdeling.pdf/_/attachment/inline/189c3c04-6baa-4007-90a5-fb49312d9e1e:e327395240bcaadedde5a2daff935836ccb888b8/Målarkitektur%20for%20dokumentdeling.pdf
Krav og prinsipper ,Retningslinjer for logging ved data- og dokumentdeling,,"Dokumentet beskriver formål med logging, hvilke hendelser som skal logges og hva som er kravene til logging.",,Nasjonale faglige råd,"Organisatorisk, Semantisk",Eksisterer,Pasientens journaldokumenter,Helsedirektoratet,Retningslinjer for logging ved data- og dokumentdeling,https://www.helsedirektoratet.no/faglige-rad/retningslinjer-for-logging-ved-data-og-dokumentdeling/retningslinjer-for-logging-ved-data-og-dokumentdeling.pdf/_/attachment/inline/185603dd-9566-4af2-aabf-6a1d032d43cb:bd0e782aa48d6dac7d1c5c23b94eda33e5779fc0/Retningslinjer%20for%20logging%20ved%20data-%20og%20dokumentdeling.pdf
Krav og prinsipper ,Krav til sikkerhetsbillett ved deling av helseopplysninger,,Felles tillitsmodell vil spesifisere hvilken informasjon som skal være med i sikkerhetsbilletten ved bruk av data- eller dokumentdeling. Aktører som tar i bruk data- eller dokumentdeling må kunne håndtere denne informasjonen. Norsk helsenett er ansvarlig for utviklingen,,Nasjonale faglige råd,"Semantisk, Teknisk",Under utvikling,Pasientens journaldokumenter,Norsk helsenett (NHN),Krav til sikkerhetsbillett ved deling av helseopplysninger,https://www.helsedirektoratet.no/faglige-rad/krav-til-sikkerhetsbillett-ved-deling-av-helseopplysninger/krav-til-sikkerhetsbillett-ved-deling-av-helseopplysninger.pdf/_/attachment/inline/0cba9fd9-6f06-4468-9207-8e02b3d16bfb:c27baa323183b22c18d6fce29167bd0ace623525/Krav%20til%20sikkerhetsbillett%20ved%20deling%20av%20helseopplysninger%20.pdf
Krav og prinsipper ,Anbefaling av tillitsmodell for data- og dokumentdeling,,Rapporten fokuserer på tilgangsstyring i data- og dokumentdeling på tvers av virksomheter og personell. Den anbefaler en tillitsmodell og overordnede prinsipper som skal gjelde for tilgangsstyring på tvers av virksomheter. Anbefalingen inkluderer også videre steg for å realisere tillitsmodellen.,,,Organisatorisk,Eksisterer,"Pasientens journaldokumenter, Pasientens kritiske informasjon, Pasientens prøvesvar, Pasientens legemiddelliste",Helsedirektoratet,Anbefaling av tillitsmodell for data- og dokumentdeling,https://www.helsedirektoratet.no/rapporter/anbefaling-av-tillitsmodell-for-data-og-dokumentdeling/anbefaling-av-tillitsmodell-for-data-og-dokumentdeling.pdf/_/attachment/inline/1691ec4d-7332-4121-84b4-d8096727a9db:b1a5bb9014e31fd609fc3bd3e5e38ee28d5e207a/Anbefaling%20av%20tillitsmodell%20for%20data-%20og%20dokumentdeling.pdf
Krav og prinsipper ,Begrepsdefinisjoner for tilgangsbegrensning mv. i behandlingsrettede helseregistre,,"Formålet med begrepsdefinisjonene er enhetlig bruk av begreper for tilgangsbegrensning i behandlingsrettede helseregistre, herunder EPJ-systemer og nasjonale e?helseløsninger.",,,"Organisatorisk, Semantisk",Eksisterer,Pasientens prøvesvar,Helsedirektoratet,Begrepsdefinisjoner for tilgangsbegrensning mv. i behandlingsrettede helseregistre,https://www.ehelse.no/standardisering/standarder/Begrepsdefinisjoner%20for%20tilgangsbegrensning%20mv.%20i%20behandlingsrettede%20helseregistre
Krav og prinsipper ,Veileder for åpne API i helse- og omsorgsektoren,,"Veilederen gir føringer og anbefalinger om hva som definerer et API som åpent. Dette gjør det enklere for sektoren å gjøre sine API åpne for andre, sette krav om åpne API ved bestillinger til leverandører og gjør det lettere for leverandører å markedsføre produktene sine med åpne API",,,"Organisatorisk, Teknisk",Eksisterer,"Pasientens kritiske informasjon, Pasientens legemiddelliste",Helsedirektoratet,Veileder for åpne API i helse- og omsorgsektoren,https://www.helsedirektoratet.no/rapporter/veileder-for-apne-api-i-helse-og-omsorgssektoren/Veileder%20for%20%C3%A5pne%20API%20i%20helse-%20og%20omsorgssektoren%20HITR-1229-2020.pdf/_/attachment/inline/61f9030b-6da9-45d9-bfec-e948a3883f75:9927bb092a892ff3f0f80cf4f6d5a41980cacdd1/Veileder%20for%20%C3%A5pne%20API%20i%20helse-%20og%20omsorgssektoren%20HITR-1229-2020.pdf
Krav og prinsipper ,Veileder om internasjonale standarder på legemiddelområdet,,Dokumentet beskriver hvilke internasjonale standarder på legemiddelområdet som bør brukes til ulike formål og hvilke tiltak som bør gjennomføres for å sikre at standardene blir tatt i bruk på en enhetlig måte.,,,"Organisatorisk, Semantisk",Eksisterer,Pasientens legemiddelliste,Helsedirektoratet,Veileder om internasjonale standarder på legemiddelområdet,https://www.helsedirektoratet.no/rapporter/internasjonale-standarder-for-legemiddelinformasjon/Internasjonale%20standarder%20for%20legemiddelinformasjon%20(HITR%201245_2022).pdf/_/attachment/inline/78878ca9-d1ee-47d3-84e8-6c46782eb8d7:71f70efce58555a635c49180e19c88c43e983735/Internasjonale%20standarder%20for%20legemiddelinformasjon%20(HITR%201245_2022).pdf
Kodeverk og terminologi ,Norsk patologikodeverk,,"Norsk patologikodeverk (NORPAT) er et kodeverk som blir benyttet ved patologilaboratorier, innen rettspatologi, i biobankarbeid og for innrapportering til Kreftregisteret. Kodeverket inneholder også et uttrekk koder for aktivitetsregistrering (APAT).",,Anbefalt standard,Semantisk,Eksisterer,Pasientens prøvesvar,Helsedirektoratet,Norsk patologikodeverk,https://www.helsedirektoratet.no/standarder/norsk-patologikodeverk-norpat
Kodeverk og terminologi ,Norsk laboratoriekodeverk (NLK),,"Norsk laboratoriekodeverk (NLK) baserer seg på den internasjonale NPU-terminologien (NPU: Nomenclature for Properties and Units) som omfatter koder og terminoloigi for laboratorieundersøkelser i helse- og omsorgstjenesten. NLK er anbefalt nasjonal standard for kommunikasjon av laboratorieanalyser til rekvirenter både i spesialist- og primærhelsetjenesten. I tillegg til NLK, finnes de nasjonale kodeverkene Prøvemateriale, Anatomisk lokalisasjon, Tekstlige resultatverdier og Undersøkelsesmetode. Disse brukes som supplerende informasjon til NLK i meldingsutveksling.",,Anbefalt standard,Semantisk,Eksisterer,Pasientens prøvesvar,Helsedirektoratet,Norsk laboratoriekodeverk,https://www.helsedirektoratet.no/standarder/norsk-laboratoriekodeverk-nlk
Kodeverk og terminologi ,Norsk klassifikasjon av radiologiske prosedyrer (NCRP),,Kodeverk for radiologi og nukleærmedisin. Kodeverket skal brukes for å dokumentere og skal kunne brukes for å bestille radiologiske tjenester.,,Obligatorisk standard,Semantisk,Eksisterer,Pasientens prøvesvar,Helsedirektoratet,NCRP: Norsk klassifikasjon av radiologiske prosedyrer,https://www.helsedirektoratet.no/digitalisering-og-e-helse/helsefaglige-kodeverk/nkpk
Teknisk samhandlingsform ,Samhandlingsform: Portaltilgang,,"Tilgang til fellesløsning eller løsning i en annen virksomhet, for eksempel gjennom en portal med innlogging.",,,Teknisk,Eksisterer,"Pasientens journaldokumenter, Pasientens kritiske informasjon, Pasientens prøvesvar",Helsedirektoratet,Oversikt over tekniske samhandlingsformer,https://www.helsedirektoratet.no/digitalisering-og-e-helse/nasjonal-arkitektur/oversikt-over-digitale-samhandlingsformer#tekniskesamhandlingsformer
Teknisk samhandlingsform ,Samhandlingsform: Datadeling,,Deling av data mellom helseaktører og med innbygger gjennom felles ressurser eller tjenester i sanntid. For eksempel kan API-er benyttes for å dele strukturerte data.,,,Teknisk,Eksisterer,"Pasientens kritiske informasjon, Pasientens prøvesvar, Pasientens legemiddelliste",Helsedirektoratet,Oversikt over tekniske samhandlingsformer,https://www.helsedirektoratet.no/digitalisering-og-e-helse/nasjonal-arkitektur/oversikt-over-digitale-samhandlingsformer#tekniskesamhandlingsformer
Teknisk samhandlingsform ,Samhandlingsform: Meldingsutveksling,,Elektronisk meldingsutveksling innebærer overføring og mottak av strukturerte data fra og til kjente avsendere og mottakere og kan benyttes i den organisatoriske samhandlingsformen sende og motta.,,,Teknisk,Eksisterer,Pasientens prøvesvar,Helsedirektoratet,Oversikt over tekniske samhandlingsformer,https://www.helsedirektoratet.no/digitalisering-og-e-helse/nasjonal-arkitektur/oversikt-over-digitale-samhandlingsformer#tekniskesamhandlingsformer
Teknisk samhandlingsform ,Samhandlingsform: Dokumentdeling,,"Dokumentdeling omhandler deling av godkjente, lesbare dokumenter, inkludert bilder, gjennom felles infrastruktur/tjenester. Der kan en 
konsument søke etter tilgjengelige dokumenter om en gitt pasient hos andre virksomheter og få tilgang til dokumentene. ",,,Teknisk,Eksisterer,Pasientens journaldokumenter,Helsedirektoratet,Oversikt over tekniske samhandlingsformer,https://www.helsedirektoratet.no/digitalisering-og-e-helse/nasjonal-arkitektur/oversikt-over-digitale-samhandlingsformer#tekniskesamhandlingsformer
Informasjonslager ,Dokumentlager (Document Repository),,"Tjeneste i dokumentdelingsløsninger som tilbyr oppbevaring, henting og tilgjengeliggjøring av dokumenter. Hvert samarbeidsområde må minst ha ett dokumentlager, men kan også ha flere.",,,Teknisk,Eksisterer,Pasientens journaldokumenter,Det enkelte samarbeidsområdet,Målarkitektur for dokumentdeling,https://www.helsedirektoratet.no/faglige-rad/malarkitektur-for-dokumentdeling/malarkitektur-for-dokumentdeling.pdf/_/attachment/inline/189c3c04-6baa-4007-90a5-fb49312d9e1e:e327395240bcaadedde5a2daff935836ccb888b8/Målarkitektur%20for%20dokumentdeling.pdf
Samhandlingskomponent ,Nasjonalt koblingspunkt (Clinical Affinity Domain / XCA Gateway),,Koblingspunkt som gjør det mulig for lokale/regionale koblingspunkter å spørre om og hente dokumenter på tvers av samarbeidsområder uten å kontakte de ulike koblingspunktene direkte.,,,Teknisk,Eksisterer,Pasientens journaldokumenter,Det enkelte samarbeidsområdet,Målarkitektur for dokumentdeling,https://www.helsedirektoratet.no/faglige-rad/malarkitektur-for-dokumentdeling/malarkitektur-for-dokumentdeling.pdf/_/attachment/inline/189c3c04-6baa-4007-90a5-fb49312d9e1e:e327395240bcaadedde5a2daff935836ccb888b8/Målarkitektur%20for%20dokumentdeling.pdf
Samhandlingskomponent ,Innbygger-STS (Secure Token Service),,Komponent som beskriver hvilken innloggingsløsning innbygger har valgt å bruke,,,Teknisk,Eksisterer,Pasientens kritiske informasjon,Norsk helsenett (NHN),Målarkitektur for datadeling i helse- og omsorgssektoren,https://www.helsedirektoratet.no/faglige-rad/malarkitektur-for-datadeling-i-helse-og-omsorgssektoren/malarkitektur-for-datadeling-i-helse-og-omsorgssektoren.pdf/_/attachment/inline/c896939e-1556-4a68-ad79-fb218d6370eb:37a01f4b4eb932b51b3cd8d50d9b8b02a2555732/Målarkitektur%20for%20datadeling%20i%20helse-%20og%20omsorgssektoren.pdf
Organisatorisk samhandlingsform ,Samhandlingsform: Endre og dele,,"Endre og dele benyttes når det er viktig å ha en felles kilde til informasjonen, som kan oppdateres av ulike aktører.
",,,Organisatorisk,Eksisterer,"Pasientens kritiske informasjon, Pasientens legemiddelliste",Helsedirektoratet,Oversikt over organisatoriske samhandlingsformer,https://www.helsedirektoratet.no/digitalisering-og-e-helse/nasjonal-arkitektur/oversikt-over-digitale-samhandlingsformer#organisatoriskesamhandlingsformer
Organisatorisk samhandlingsform ,Samhandlingsform: Slå opp og tilgjengeliggjøre,,"Slå opp og tilgjengeliggjøre støtter samhandlingstjenester hvor det er behov for å tilgjengeliggjøre informasjon fra en bruker til flere andre ikke navngitte brukere. De kan da slå opp gjennom avtalte kanaler og tilegne seg denne informasjonen når de har behov for det, uavhengig av når den ble tilgjengeliggjort.",,,Organisatorisk,Eksisterer,"Pasientens journaldokumenter, Pasientens prøvesvar",Helsedirektoratet,Oversikt over organisatoriske samhandlingsformer,https://www.helsedirektoratet.no/digitalisering-og-e-helse/nasjonal-arkitektur/oversikt-over-digitale-samhandlingsformer#organisatoriskesamhandlingsformer
Informasjonsmodell ,Metadata for dokumentdeling (IHE XDS metadata),,Norsk profil for IHE XDS metadata. Formålet med profilen er å understøtte mest mulig lik implementering av XDS i Norge og skape en felles forståelse for hvilke metadata som kan gjøres tilgjengelig.,,Anbefalt standard,Semantisk,Eksisterer,Pasientens journaldokumenter,Helsedirektoratet,Norsk profil for IHE XDS.b,https://www.helsedirektoratet.no/standarder/ihe-xds-metadata
Faktaark ,Testing og testdata (faktaark 43),,"Formålet med faktaarket er å sikre konfidensialitet, integritet, tilgjengelighet og kvalitet når testdata brukes i utvikling og test av IT-systemer med helse- og personopplysninger.",,,,Eksisterer,"Pasientens journaldokumenter, Pasientens kritiske informasjon, Pasientens legemiddelliste, Pasientens måledata",Normen,Testing og testdata (faktaark 43),https://www.helsedirektoratet.no/normen/testing-og-testdata-faktaark-43
Faktaark ,Sikkerhetskrav og sikkerhetsdokumentasjon i IKT-prosjekter (faktaark 37),,"Formålet er å sikre tilfredsstillende informasjonssikkerhet og god sikkerhetsdokumentasjon i prosjekter som skal endre eller innføre nye IKT-løsninger. Påse at sikkerhetsløsninger og -dokumentasjon overføres til driftsmiljøet ved endt prosjekt. 

Prosjektleder vil normalt få delegert ansvar fra dataansvarlig for å påse at prosjekter gjennomføres med tilfredsstillende informasjonssikkerhet. Gjennomføres fra prosjekter planlegges/startes opp og til de overføres til ordinær drift.

Alle prosjekter som skal innføre/endre/utvide en IKT-løsning som inkluderer behandling av helse- og personopplysninger.",,,,Eksisterer,"Pasientens journaldokumenter, Pasientens kritiske informasjon, Pasientens legemiddelliste, Pasientens måledata",Normen,Sikkerhetskrav og sikkerhetsdokumentasjon i IKT-prosjekter (faktaark 37),https://www.helsedirektoratet.no/normen/sikkerhetskrav-og-sikkerhetsdokumentasjon-i-ikt-prosjekter-faktaark-37
Faktaark ,Bruk av databehandler (faktaark 10),,Faktaarket skal sikre at helse- og personopplysninger ikke skal behandles på annen måte enn det som er avtalt med databehandlingsansvarlig.,,,,Eksisterer,"Pasientens journaldokumenter, Pasientens måledata",Normen,Bruk av databehandler (faktaark 10),https://www.helsedirektoratet.no/normen/bruk-av-databehandler-faktaark-10
Faktaark ,Sperret adresse i folkeregisteret (faktaark 55),,"Faktaarkets formål er å bidra til at helse- og omsorgssektoren opprettholder beskyttelse for trusselutsatte. Adressesperre i Folkeregisteret er et tiltak for å beskytte trusselutsatte personer, dvs. personer som står i fare for å bli utsatt for alvorlig kriminalitet rettet mot liv, helse eller frihet. Typiske eksempler er vitner, informanter og personer som har blitt eller er utsatt for vold og trusler.",,,,Eksisterer,"Pasientens journaldokumenter, Pasientens kritiske informasjon, Pasientens prøvesvar, Pasientens legemiddelliste, Pasientens måledata",Normen,Sperret adresse i folkeregisteret (faktaark 55),https://www.helsedirektoratet.no/normen/trusselutsatte-personer-med-adressesperre-faktaark-55
Faktaark ,Kommunikasjon over åpne nett (faktaark 24),,Faktaarkets formål er å beskrive tiltak som skal ivareta tilfredsstillende sikkerhet ved elektronisk kommunikasjon av helse- og personopplysninger over åpne nett.,,,"Organisatorisk, Teknisk",Eksisterer,"Pasientens journaldokumenter, Pasientens kritiske informasjon, Pasientens prøvesvar, Pasientens legemiddelliste, Pasientens måledata",Normen,Kommunikasjon over åpne nett (faktaark 24),https://www.helsedirektoratet.no/normen/kommunikasjon-over-apne-nett-faktaark-24
Faktaark ,Sikkerhets- og samhandlingsarkitektur ved tilgang til helseopplysninger mellom virksomheter (faktaark 20c),,Faktaarkets formål er å standardisere virksomhetens sikkerhetsfunksjoner og etablere tilfredsstillende sikkerhet ved elektronisk samhandling med andre aktører i helse- og sosialsektoren.,,,"Organisatorisk, Teknisk",Eksisterer,"Pasientens journaldokumenter, Pasientens kritiske informasjon, Pasientens prøvesvar, Pasientens legemiddelliste, Pasientens måledata",Normen,Sikkerhets- og samhandlingsarkitektur ved tilgang til helseopplysninger mellom virksomheter (faktaark 20c),https://www.helsedirektoratet.no/normen/sikkerhets-og-samhandlingsarkitektur-ved-tilgang-til-helseopplysninger-mellom-virksomheter-faktaark-20c
Faktaark ,Tilgangsstyring (faktaark 14),,"Formålet med faktaarket er å gi en oversikt over krav til tilgangsstyring. Tilgangsstyring innebærer å sikre at helse- og personopplysninger bare er tilgjengelig etter tjenstlig behov ved at brukere blir autentisert på en betryggende måte og at tilgang blir tildelt, administrert, kontrollert og fjernet.",,,"Organisatorisk, Teknisk",Eksisterer,"Pasientens journaldokumenter, Pasientens kritiske informasjon, Pasientens prøvesvar, Pasientens legemiddelliste, Pasientens måledata",Normen,Tilgangsstyring (faktaark 14),https://www.helsedirektoratet.no/normen/tilgangsstyring-faktaark-14
Faktaark ,Logging og innsyn i logg (faktaark 15),,Formålet med faktaarket er å gi veiledning til hvordan virksomheten bør gå frem for å etterleve Normens krav til logging og loggoppfølging. Faktaarket tar også for seg prosessen for innsyn i logg fra behandlingsrettet helseregister. ,,,"Organisatorisk, Teknisk",Eksisterer,"Pasientens journaldokumenter, Pasientens kritiske informasjon, Pasientens prøvesvar, Pasientens legemiddelliste, Pasientens måledata",Normen,Logging og innsyn i logg (faktaark 15),https://www.helsedirektoratet.no/normen/logging-og-innsyn-i-logg-faktaark-15
