informasjonstype,navn,ingress,beskrivelse,kontekstavhengig_beskrivelse,normeringsniva,eif_niva,status,samhandlingstjenester,ansvarlig,referanse_lenketekst,referanse_url
Veileder ,Veileder i digital pasientkommunikasjon,,Veilederen gir informasjon til etterlevelse av kravene om tekniske og administrative tiltak ved etablering av løsninger for pasientkommunikasjon.,,,Organisatorisk,Eksisterer,"Pasientens journaldokumenter, Pasientens måledata",Normen,Veileder i digital pasientkommunikasjon,https://www.helsedirektoratet.no/normen/digital-pasientkommunikasjon
Veileder ,Veileder om risikostyring i informasjonssikkerhet og personvern,,"Denne veilederen skal gi veiledning til, og bidra til etterlevelse av, kravene i Normen knyttet til risikostyring.",,,,Eksisterer,"Pasientens journaldokumenter, Pasientens kritiske informasjon, Pasientens prøvesvar, Pasientens legemiddelliste, Pasientens måledata",Normen,Veileder om risikostyring i informasjonssikkerhet og personvern,https://www.helsedirektoratet.no/normen/risikostyring-for-informasjonssikkerhet-og-personvern
Veileder ,Veileder for rettigheter ved behandling av helse og personopplysninger,,Gir virksomheter i helse- og omsorgstjenesten veiledning i hvordan de registrertes rettigheter kan ivaretas herunder pasienters rettigheter som registrerte.,,,,Eksisterer,"Pasientens journaldokumenter, Pasientens kritiske informasjon, Pasientens prøvesvar, Pasientens legemiddelliste, Pasientens måledata",Normen,Veileder for rettigheter ved behandling av helse og personopplysninger,https://www.helsedirektoratet.no/normen/rettigheter-ved-behandling-av-helse-og-personopplysninger#10.2.3%20Behandling%20av%20helseopplysninger%20i%20Nasjonal%20kjernejournal
Veileder ,Veileder for tilgang til helse- og personopplysninger,,Gir veiledning til og bidrar til etterlevelse av kravene Normen stiller til etablering av tilfredsstillende tilgangsstyring innad i virksomheten.,,,Organisatorisk,Eksisterer,"Pasientens journaldokumenter, Pasientens kritiske informasjon, Pasientens prøvesvar, Pasientens legemiddelliste, Pasientens måledata",Normen,Veileder for tilgang til helse- og personopplysninger,https://www.helsedirektoratet.no/normen/tilgang-til-helse-og-personopplysninger
Lov ,Helsepersonelloven,,Loven setter krav til helsepersonells yrkesutøvelse og krav til virksomheter som yter helsehjelp. Den omfatter blant annet bestemmelser om taushetsplikt og krav til forsvarlighet.,Pasientens journaldokumenter: For samhandlingstjenesten pasientens journaldokumenter er det særlig helsepersonelloven § 45 som er relevant. Bestemmelsen er et unntak fra taushetsplikten som fastslår rett og plikt til å gjøre nødvendige og relevante opplysninger tilgjengelige for helsepersonell som trenger dem i forbindelse med helsehjelp. Det er helsepersonellet eller virksomheten som tilgjengeliggjør opplysningene for andre som har ansvaret for at vilkårene for å tilgjengeliggjøringen er oppfylt. Pasientens måledata: For samhandlingstjenesten pasientens måledata er det særlig helsepersonelloven § 45 som er relevant. Bestemmelsen er et unntak fra taushetsplikten som fastslår rett og plikt til å gjøre nødvendige og relevante opplysninger tilgjengelige for helsepersonell som trenger dem i forbindelse med helsehjelp. Det er helsepersonellet eller virksomheten som tilgjengeliggjør opplysningene for andre som har ansvaret for at vilkårene for å tilgjengeliggjøringen er oppfylt.,,Juridisk,Eksisterer,"Pasientens journaldokumenter, Pasientens kritiske informasjon, Pasientens prøvesvar, Pasientens legemiddelliste, Pasientens måledata",Helse- og omsorgsdepartementet,Lov om helsepersonell m.v. (helsepersonelloven) (lovdata.no),https://lovdata.no/dokument/NL/lov/1999-07-02-64?q=helsepersonelloven
Lov ,Pasientjournalloven,,"Både personopplysningsloven (personvernforordningen), pasientjournalloven og til dels pasient- og brukerrettighetsloven regulerer behandling av person- og helseopplysninger. Pasientjournalloven er den sentrale loven når det gjelder regulering av virksomhetenes behandling av helseopplysninger i forbindelse med ytelse av helsehjelp","Pasientens journaldokumenter: Samhandlingstjenesten pasientens journaldokumenter gir helsepersonell med tjenstlig behov innsyn i utvalgte dokumenter på tvers av helsevirksomheter. Dokumentene tilgjengeliggjøres via kjernejournal på bakgrunn av informasjonselementet referanser til ytterligere informasjon i kjernejournal, men selve dokumentene er ikke en del av kjernejournal. Det er derfor særlig §§ 13 om nasjonal kjernejournal og 19 om helseopplysninger ved helsehjelp som er relevante for denne samhandlingstjenesten. Regelverket som regulerer kjernejournal setter den ytre ramme for dokumentdelingen, herunder til hvilket formål det kan gjøres oppslag til. Det rettslige grunnlaget for å gi helsepersonellet innsyn i selve dokumentene er pasientjournalloven § 19, jf. helsepersonelloven § 45. § 19 fastsetter blant annet at helsevirksomheter, innen rammen av taushetsplikten, plikter å sørge for at relevante og nødvendige opplysninger er tilgjengelige for helsepersonell som trenger dem for å ute helsehjelp. Det er imidlertid virksomheten som bestemmer hvordan opplysningene skal gjøres tilgjengelige, og det er et krav at dette gjøres på en måte som tilfredsstiller informasjonssikkerheten. For virksomheter som tilgjengeliggjør dokumenter i samhandlingstjenesten pasientens journaldokumenter, har disse virksomhetene valgt å benytte denne tjenesten som metode for å tilgjengeliggjøre de aktuelle dokumentene. Det er virksomheten som tilgjengeliggjør, som har ansvaret for at vilkårene for tilgjengeliggjøringen er oppfylt. Pasientens legemiddelliste: Pasientens legemiddelliste kan inngå i Reseptformidleren.&nbsp;Rettslig grunnlag for Reseptformidleren er pasientjournalloven § 12. Pasientens kritiske informasjon: For informasjonstjenesten Pasientens kritiske informasjon er hovedvilkåret for tilgang at helsepersonell må ha &quot;tjenstlig behov&quot; for pasientens kritiske opplysninger. Kravet til tjenstlig behov fremgår av pasientjournalloven § 13 fjerde ledd. Bestemmelsen er et unntak fra lovbestemt taushetsplikt og gjør det lovlig å tilegne seg helseopplysninger fra kjernejournal gjennom tjenesten Pasientens kritiske informasjon. I tillegg til kravet til tjenstlig behov, må helsepersonell som hovedregel innhente pasientens samtykke for å kunne gjøre oppslag i den konkrete kjernejournalen. Pasientens måledata: Både personopplysningsloven (personvernforordningen), pasientjournalloven og til dels pasient- og brukerrettighetsloven regulerer behandling av person- og helseopplysninger. Pasientjournalloven er den sentrale loven når det gjelder regulering av virksomhetenes behandling av helseopplysninger i forbindelse med ytelse av helsehjelp. Tiltaket Pasientens måledata skal samle og tilgjengeliggjøre medisinske måledata for pasienter som er i behandling og har tett oppfølging av ulike aktører på tvers av helse- og omsorgstjenesten. Tjenesten skal sikre helsepersonell enkel tilgang til oppdatert informasjon om pasientens status og dermed skape bedre informasjonsflyt på tvers av helsepersonell og ulike helsevirksomheter som samarbeider om en pasient.Det rettslige grunnlaget for å tilgjengeliggjøre måledata er pasientjournalloven § 19 jf. helsepersonelloven § 45. Etter pasientjournalloven § 19 skal helsevirksomheter, innen rammen av taushetsplikten, sørge for at relevante og nødvendige opplysninger er tilgjengelige for helsepersonell som trenger dem for å yte helsehjelp. Det er virksomheten som bestemmer hvordan opplysningene skal gjøres tilgjengelige, og det er et krav at dette gjøres på en måte som tilfredsstiller informasjonssikkerheten.",,Juridisk,Eksisterer,"Pasientens journaldokumenter, Pasientens kritiske informasjon, Pasientens prøvesvar, Pasientens legemiddelliste, Pasientens måledata",Helse- og omsorgsdepartementet,Lov om behandling av helseopplysninger ved ytelse av helsehjelp (pasientjournalloven) (lovdata.no),https://lovdata.no/dokument/NL/lov/2014-06-20-42?q=pasientjournalloven
Lov ,Proposal for a Regulation on the European Health Data Space,,EHDS-forordningen gir rammer for helhetlig informasjonsforvaltning på tvers av primær- og sekundærbruk av helsedata.,,,Juridisk,Under utvikling,Pasientens kritiske informasjon,EU-kommisjonen,Proposal for a Regulation on the European Health Data Space (PDF) (consilium.europa.eu),https://www.consilium.europa.eu/media/70909/st07553-en24.pdf
Kodeverk og terminologi ,Begrepsdefinisjoner for tilgangsbegrensning mv. i behandlingsrettede helseregistre,,"Formålet med begrepsdefinisjonene er enhetlig bruk av begreper for tilgangsbegrensning i behandlingsrettede helseregistre, herunder EPJ-systemer og nasjonale e?helseløsninger.",,Nasjonal veileder,Semantisk,Eksisterer,"Pasientens journaldokumenter, Pasientens prøvesvar",Helsedirektoratet,Begrepsdefinisjoner for tilgangsbegrensning mv. i behandlingsrettede helseregistre,https://www.helsedirektoratet.no/veiledere/begrepsdefinisjoner-for-tilgangsbegrensning-mv.i-behandlingsrettede-helseregistre
